{
  "schema_version": 2,
  "source": "queue_v2.json",
  "captured_from": "Fuzzy66 Render_Chunks_20261022 queue_v2.json",
  "owner": "no-limit-local",
  "execute": false,
  "project": "C:\\AGIOS\\Sandbox\\Render_Chunks_20261022\\src\\landfall",
  "jobs": [
    {
      "ordinal": 0,
      "id": "lf_s07_wide_t0",
      "site": "s07",
      "camera": "wide",
      "t0": 0,
      "proj": "C:\\AGIOS\\Sandbox\\Render_Chunks_20261022\\src\\landfall",
      "mk": "C:/AGIOS/Sandbox/Render_Chunks_20261022/out/v2/lf_s07_wide_t0",
      "res": "1280x720",
      "scene": "res://scenes/showcase.tscn",
      "plan": "C:/AGIOS/Sandbox/Render_Chunks_20261022/plans/plan_s07.json",
      "render_stage": 5,
      "seq": 240,
      "fps": 12,
      "zoom": 0.6,
      "follow": 0,
      "outdir": "C:/AGIOS/Sandbox/Render_Chunks_20261022/out/v2/lf_s07_wide_t0",
      "args": [
        "res://scenes/showcase.tscn",
        "--",
        "--plan=C:/AGIOS/Sandbox/Render_Chunks_20261022/plans/plan_s07.json",
        "--stage=5",
        "--seq=240",
        "--fps=12",
        "--t0=0",
        "--zoom=0.6",
        "--follow=0",
        "--outdir=C:/AGIOS/Sandbox/Render_Chunks_20261022/out/v2/lf_s07_wide_t0"
      ]
    },
    {
      "ordinal": 1,
      "id": "lf_s101_wide_t0",
      "site": "s101",
      "camera": "wide",
      "t0": 0,
      "proj": "C:\\AGIOS\\Sandbox\\Render_Chunks_20261022\\src\\landfall",
      "mk": "C:/AGIOS/Sandbox/Render_Chunks_20261022/out/v2/lf_s101_wide_t0",
      "res": "1280x720",
      "scene": "res://scenes/showcase.tscn",
      "plan": "C:/AGIOS/Sandbox/Render_Chunks_20261022/plans/plan_s101.json",
      "render_stage": 5,
      "seq": 240,
      "fps": 12,
      "zoom": 0.6,
      "follow": 0,
      "outdir": "C:/AGIOS/Sandbox/Render_Chunks_20261022/out/v2/lf_s101_wide_t0",
      "args": [
        "res://scenes/showcase.tscn",
        "--",
        "--plan=C:/AGIOS/Sandbox/Render_Chunks_20261022/plans/plan_s101.json",
        "--stage=5",
        "--seq=240",
        "--fps=12",
        "--t0=0",
        "--zoom=0.6",
        "--follow=0",
        "--outdir=C:/AGIOS/Sandbox/Render_Chunks_20261022/out/v2/lf_s101_wide_t0"
      ]
    },
    {
      "ordinal": 2,
      "id": "lf_s11_wide_t0",
      "site": "s11",
      "camera": "wide",
      "t0": 0,
      "proj": "C:\\AGIOS\\Sandbox\\Render_Chunks_20261022\\src\\landfall",
      "mk": "C:/AGIOS/Sandbox/Render_Chunks_20261022/out/v2/lf_s11_wide_t0",
      "res": "1280x720",
      "scene": "res://scenes/showcase.tscn",
      "plan": "C:/AGIOS/Sandbox/Render_Chunks_20261022/plans/plan_s11.json",
      "render_stage": 5,
      "seq": 240,
      "fps": 12,
      "zoom": 0.6,
      "follow": 0,
      "outdir": "C:/AGIOS/Sandbox/Render_Chunks_20261022/out/v2/lf_s11_wide_t0",
      "args": [
        "res://scenes/showcase.tscn",
        "--",
        "--plan=C:/AGIOS/Sandbox/Render_Chunks_20261022/plans/plan_s11.json",
        "--stage=5",
        "--seq=240",
        "--fps=12",
        "--t0=0",
        "--zoom=0.6",
        "--follow=0",
        "--outdir=C:/AGIOS/Sandbox/Render_Chunks_20261022/out/v2/lf_s11_wide_t0"
      ]
    },
    {
      "ordinal": 3,
      "id": "lf_s23_wide_t0",
      "site": "s23",
      "camera": "wide",
      "t0": 0,
      "proj": "C:\\AGIOS\\Sandbox\\Render_Chunks_20261022\\src\\landfall",
      "mk": "C:/AGIOS/Sandbox/Render_Chunks_20261022/out/v2/lf_s23_wide_t0",
      "res": "1280x720",
      "scene": "res://scenes/showcase.tscn",
      "plan": "C:/AGIOS/Sandbox/Render_Chunks_20261022/plans/plan_s23.json",
      "render_stage": 5,
      "seq": 240,
      "fps": 12,
      "zoom": 0.6,
      "follow": 0,
      "outdir": "C:/AGIOS/Sandbox/Render_Chunks_20261022/out/v2/lf_s23_wide_t0",
      "args": [
        "res://scenes/showcase.tscn",
        "--",
        "--plan=C:/AGIOS/Sandbox/Render_Chunks_20261022/plans/plan_s23.json",
        "--stage=5",
        "--seq=240",
        "--fps=12",
        "--t0=0",
        "--zoom=0.6",
        "--follow=0",
        "--outdir=C:/AGIOS/Sandbox/Render_Chunks_20261022/out/v2/lf_s23_wide_t0"
      ]
    },
    {
      "ordinal": 4,
      "id": "lf_s42_wide_t0",
      "site": "s42",
      "camera": "wide",
      "t0": 0,
      "proj": "C:\\AGIOS\\Sandbox\\Render_Chunks_20261022\\src\\landfall",
      "mk": "C:/AGIOS/Sandbox/Render_Chunks_20261022/out/v2/lf_s42_wide_t0",
      "res": "1280x720",
      "scene": "res://scenes/showcase.tscn",
      "plan": "C:/AGIOS/Sandbox/Render_Chunks_20261022/plans/plan_s42.json",
      "render_stage": 5,
      "seq": 240,
      "fps": 12,
      "zoom": 0.6,
      "follow": 0,
      "outdir": "C:/AGIOS/Sandbox/Render_Chunks_20261022/out/v2/lf_s42_wide_t0",
      "args": [
        "res://scenes/showcase.tscn",
        "--",
        "--plan=C:/AGIOS/Sandbox/Render_Chunks_20261022/plans/plan_s42.json",
        "--stage=5",
        "--seq=240",
        "--fps=12",
        "--t0=0",
        "--zoom=0.6",
        "--follow=0",
        "--outdir=C:/AGIOS/Sandbox/Render_Chunks_20261022/out/v2/lf_s42_wide_t0"
      ]
    },
    {
      "ordinal": 5,
      "id": "lf_s77_wide_t0",
      "site": "s77",
      "camera": "wide",
      "t0": 0,
      "proj": "C:\\AGIOS\\Sandbox\\Render_Chunks_20261022\\src\\landfall",
      "mk": "C:/AGIOS/Sandbox/Render_Chunks_20261022/out/v2/lf_s77_wide_t0",
      "res": "1280x720",
      "scene": "res://scenes/showcase.tscn",
      "plan": "C:/AGIOS/Sandbox/Render_Chunks_20261022/plans/plan_s77.json",
      "render_stage": 5,
      "seq": 240,
      "fps": 12,
      "zoom": 0.6,
      "follow": 0,
      "outdir": "C:/AGIOS/Sandbox/Render_Chunks_20261022/out/v2/lf_s77_wide_t0",
      "args": [
        "res://scenes/showcase.tscn",
        "--",
        "--plan=C:/AGIOS/Sandbox/Render_Chunks_20261022/plans/plan_s77.json",
        "--stage=5",
        "--seq=240",
        "--fps=12",
        "--t0=0",
        "--zoom=0.6",
        "--follow=0",
        "--outdir=C:/AGIOS/Sandbox/Render_Chunks_20261022/out/v2/lf_s77_wide_t0"
      ]
    },
    {
      "ordinal": 6,
      "id": "lf_s07_close_t0",
      "site": "s07",
      "camera": "close",
      "t0": 0,
      "proj": "C:\\AGIOS\\Sandbox\\Render_Chunks_20261022\\src\\landfall",
      "mk": "C:/AGIOS/Sandbox/Render_Chunks_20261022/out/v2/lf_s07_close_t0",
      "res": "1280x720",
      "scene": "res://scenes/showcase.tscn",
      "plan": "C:/AGIOS/Sandbox/Render_Chunks_20261022/plans/plan_s07.json",
      "render_stage": 5,
      "seq": 240,
      "fps": 12,
      "zoom": 1.6,
      "follow": 1,
      "outdir": "C:/AGIOS/Sandbox/Render_Chunks_20261022/out/v2/lf_s07_close_t0",
      "args": [
        "res://scenes/showcase.tscn",
        "--",
        "--plan=C:/AGIOS/Sandbox/Render_Chunks_20261022/plans/plan_s07.json",
        "--stage=5",
        "--seq=240",
        "--fps=12",
        "--t0=0",
        "--zoom=1.6",
        "--follow=1",
        "--outdir=C:/AGIOS/Sandbox/Render_Chunks_20261022/out/v2/lf_s07_close_t0"
      ]
    },
    {
      "ordinal": 7,
      "id": "lf_s101_close_t0",
      "site": "s101",
      "camera": "close",
      "t0": 0,
      "proj": "C:\\AGIOS\\Sandbox\\Render_Chunks_20261022\\src\\landfall",
      "mk": "C:/AGIOS/Sandbox/Render_Chunks_20261022/out/v2/lf_s101_close_t0",
      "res": "1280x720",
      "scene": "res://scenes/showcase.tscn",
      "plan": "C:/AGIOS/Sandbox/Render_Chunks_20261022/plans/plan_s101.json",
      "render_stage": 5,
      "seq": 240,
      "fps": 12,
      "zoom": 1.6,
      "follow": 1,
      "outdir": "C:/AGIOS/Sandbox/Render_Chunks_20261022/out/v2/lf_s101_close_t0",
      "args": [
        "res://scenes/showcase.tscn",
        "--",
        "--plan=C:/AGIOS/Sandbox/Render_Chunks_20261022/plans/plan_s101.json",
        "--stage=5",
        "--seq=240",
        "--fps=12",
        "--t0=0",
        "--zoom=1.6",
        "--follow=1",
        "--outdir=C:/AGIOS/Sandbox/Render_Chunks_20261022/out/v2/lf_s101_close_t0"
      ]
    },
    {
      "ordinal": 8,
      "id": "lf_s11_close_t0",
      "site": "s11",
      "camera": "close",
      "t0": 0,
      "proj": "C:\\AGIOS\\Sandbox\\Render_Chunks_20261022\\src\\landfall",
      "mk": "C:/AGIOS/Sandbox/Render_Chunks_20261022/out/v2/lf_s11_close_t0",
      "res": "1280x720",
      "scene": "res://scenes/showcase.tscn",
      "plan": "C:/AGIOS/Sandbox/Render_Chunks_20261022/plans/plan_s11.json",
      "render_stage": 5,
      "seq": 240,
      "fps": 12,
      "zoom": 1.6,
      "follow": 1,
      "outdir": "C:/AGIOS/Sandbox/Render_Chunks_20261022/out/v2/lf_s11_close_t0",
      "args": [
        "res://scenes/showcase.tscn",
        "--",
        "--plan=C:/AGIOS/Sandbox/Render_Chunks_20261022/plans/plan_s11.json",
        "--stage=5",
        "--seq=240",
        "--fps=12",
        "--t0=0",
        "--zoom=1.6",
        "--follow=1",
        "--outdir=C:/AGIOS/Sandbox/Render_Chunks_20261022/out/v2/lf_s11_close_t0"
      ]
    },
    {
      "ordinal": 9,
      "id": "lf_s23_close_t0",
      "site": "s23",
      "camera": "close",
      "t0": 0,
      "proj": "C:\\AGIOS\\Sandbox\\Render_Chunks_20261022\\src\\landfall",
      "mk": "C:/AGIOS/Sandbox/Render_Chunks_20261022/out/v2/lf_s23_close_t0",
      "res": "1280x720",
      "scene": "res://scenes/showcase.tscn",
      "plan": "C:/AGIOS/Sandbox/Render_Chunks_20261022/plans/plan_s23.json",
      "render_stage": 5,
      "seq": 240,
      "fps": 12,
      "zoom": 1.6,
      "follow": 1,
      "outdir": "C:/AGIOS/Sandbox/Render_Chunks_20261022/out/v2/lf_s23_close_t0",
      "args": [
        "res://scenes/showcase.tscn",
        "--",
        "--plan=C:/AGIOS/Sandbox/Render_Chunks_20261022/plans/plan_s23.json",
        "--stage=5",
        "--seq=240",
        "--fps=12",
        "--t0=0",
        "--zoom=1.6",
        "--follow=1",
        "--outdir=C:/AGIOS/Sandbox/Render_Chunks_20261022/out/v2/lf_s23_close_t0"
      ]
    },
    {
      "ordinal": 10,
      "id": "lf_s42_close_t0",
      "site": "s42",
      "camera": "close",